{
  "schema_version": "1",
  "batch_id": "m5-5-recalibration-20260907",
  "before_count": 20,
  "after_count": 16,
  "events": [
    {
      "event_id": "m5-5-recalibration-20260907-event-0001",
      "relation_id": "m5-5-w360-s1-r2",
      "operation": "remove",
      "source_sense": "w360-s1",
      "before": {
        "target": "w123",
        "target_sense": "w123-s1",
        "type": "association"
      },
      "error_category": "incidental-co-occurrence"
    },
    {
      "event_id": "m5-5-recalibration-20260907-event-0002",
      "relation_id": "m5-5-w361-s1-r1",
      "operation": "retype",
      "source_sense": "w361-s1",
      "before": {
        "target": "w026",
        "target_sense": "w026-s1",
        "type": "association"
      },
      "after": {
        "target": "w026",
        "target_sense": "w026-s1",
        "type": "near"
      },
      "changed_fields": [
        "type"
      ],
      "error_category": "sense-target-type-error"
    },
    {
      "event_id": "m5-5-recalibration-20260907-event-0003",
      "relation_id": "m5-5-w366-s1-r1",
      "operation": "retarget",
      "source_sense": "w366-s1",
      "before": {
        "target": "w041",
        "target_sense": "w041-s1",
        "type": "sensory"
      },
      "after": {
        "target": "r049",
        "target_sense": "r049-s1",
        "type": "sensory"
      },
      "changed_fields": [
        "target",
        "target_sense"
      ],
      "error_category": "unsupported-cross-sensory"
    },
    {
      "event_id": "m5-5-recalibration-20260907-event-0004",
      "relation_id": "m5-5-w374-s1-r1",
      "operation": "remove",
      "source_sense": "w374-s1",
      "before": {
        "target": "w124",
        "target_sense": "w124-s1",
        "type": "scene"
      },
      "error_category": "broad-common-category"
    },
    {
      "event_id": "m5-5-recalibration-20260907-event-0005",
      "relation_id": "m5-5-w381-s1-r1",
      "operation": "remove",
      "source_sense": "w381-s1",
      "before": {
        "target": "w125",
        "target_sense": "w125-s1",
        "type": "mood"
      },
      "error_category": "generic-result-or-reaction"
    },
    {
      "event_id": "m5-5-recalibration-20260907-event-0006",
      "relation_id": "m5-5-w387-s1-r1",
      "operation": "remove",
      "source_sense": "w387-s1",
      "before": {
        "target": "w126",
        "target_sense": "w126-s1",
        "type": "scene"
      },
      "error_category": "arbitrary-modifier-or-place"
    }
  ],
  "source_note": "Reviewed relation snapshots only; raw draft material remains outside the repository."
}
